<!ELEMENT boutique (telephone*)>
<!ELEMENT telephone (marque, modele, dispo)>
<!ELEMENT marque (#PCDATA)>
<!ELEMENT modele (#PCDATA)>
<!ELEMENT dispo (#PCDATA)>
